{"$schema":"https://json-schema.org/draft/2020-12/schema","type":"object","additionalProperties":false,"required":["vat_jurisdiction","supplier_vat_charging","reverse_charge","invoice_treatment","eu_recap_reporting","aam"],"properties":{"vat_jurisdiction":{"$ref":"#/$defs/stage"},"supplier_vat_charging":{"$ref":"#/$defs/stage"},"reverse_charge":{"$ref":"#/$defs/stage"},"invoice_treatment":{"$ref":"#/$defs/stage"},"eu_recap_reporting":{"$ref":"#/$defs/stage"},"aam":{"$ref":"#/$defs/stage"}},"$defs":{"stage":{"type":"object","additionalProperties":false,"required":["status","value","rule_id","evidence","assumptions","reason"],"properties":{"status":{"enum":["determined","partial","not_assessed","cannot_determine","requires_review"]},"value":{},"rule_id":{"type":["string","null"]},"evidence":{"type":"array","items":{"$ref":"evidence.schema.json"}},"assumptions":{"type":"array","items":{"type":"string"}},"reason":{"type":"string"}}}}}
